{
  "schema_version": "1.0",
  "title": "Review: Decrement stock when an order is placed",
  "language": "en-US",
  "steps": [
    {
      "id": "S00",
      "kind": "intro",
      "finding_id": null,
      "text": "Hi. This change teaches the inventory service to react to new orders, and adds a column for reserved stock. There are two issues I'd fix before merging, and two smaller ones.",
      "subtitle": null,
      "focus": null,
      "estimated_seconds": 12
    },
    {
      "id": "S01",
      "kind": "finding",
      "finding_id": "F01",
      "text": "Let's start with the consumer. Messages can be delivered more than once, but this handler decrements stock every time it runs. So a single retry means the order is counted twice. Keep a record of processed events, in the same transaction as the stock update, and skip anything you've already handled.",
      "subtitle": null,
      "focus": {
        "file": "services/inventory-service/src/interface/messaging/order-placed.consumer.ts",
        "side": "new",
        "line_start": 14,
        "line_end": 18
      },
      "estimated_seconds": 21
    },
    {
      "id": "S02",
      "kind": "finding",
      "finding_id": "F02",
      "text": "Now the migration. It adds a column that can't be null, but gives it no default. On Postgres, that fails as soon as the table has any rows. It will work on an empty dev database and then break in production. Adding a default of zero fixes it.",
      "subtitle": null,
      "focus": {
        "file": "services/inventory-service/src/infrastructure/persistence/migrations/1726400000000-AddReservedQuantity.ts",
        "side": "new",
        "line_start": 5,
        "line_end": 7
      },
      "estimated_seconds": 19
    },
    {
      "id": "S03",
      "kind": "finding",
      "finding_id": "F03",
      "text": "Back in the consumer, each item is updated on its own. If the third item fails, the first two stay decremented. It's safer to update the whole order in one transaction, and publish a failure event if any item can't be reserved.",
      "subtitle": null,
      "focus": {
        "file": "services/inventory-service/src/interface/messaging/order-placed.consumer.ts",
        "side": "new",
        "line_start": 16,
        "line_end": 18
      },
      "estimated_seconds": 17
    },
    {
      "id": "S04",
      "kind": "finding",
      "finding_id": "F04",
      "text": "Last, a small one. The down method is empty, so this migration can't be rolled back. Dropping the new column there would fix that.",
      "subtitle": null,
      "focus": {
        "file": "services/inventory-service/src/infrastructure/persistence/migrations/1726400000000-AddReservedQuantity.ts",
        "side": "new",
        "line_start": 10,
        "line_end": 10
      },
      "estimated_seconds": 10
    },
    {
      "id": "S05",
      "kind": "wrap_up",
      "finding_id": null,
      "text": "To sum up: make the consumer idempotent and give the new column a default before merging. The other two are quick wins. Thanks!",
      "subtitle": null,
      "focus": null,
      "estimated_seconds": 9
    }
  ]
}
